{
  "automation_id": "example_automation",
  "name": "Example Automation Template",
  "summary": "Example Automation Template for use in contributor documentation",
  "maintainers": ["EPMatt"],
  "variants": ["EPMatt"],
  "domain": "automation",
  "category": "example",
  "tags": ["example", "documentation"],
  "status": "stable"
}
