{
  "automation_id": "addon_update_notification",
  "name": "Send a mobile notification when add-on update is available",
  "summary": "Send a notification to the provided mobile devices whenever an update for the given Home Assistant add-on is available.",
  "maintainers": ["EPMatt"],
  "variants": ["EPMatt"],
  "domain": "automation",
  "category": "notification",
  "tags": ["notification", "update"],
  "status": "stable"
}
